{
  "contract_name": "control_plane.event",
  "contract_version": "1.0.0",
  "schema_version": "1.0.0",
  "taxonomy_version": "taxonomy-recon-v1",
  "tenant_id": "tenant-lab-001",
  "customer_context_id": "customer-context-main",
  "environment": "phase0_lab",
  "correlation_id": "corr-control-plane-001",
  "causation_id": null,
  "idempotency_key": "idem-control-plane-event-001",
  "producer": {
    "component": "supervisor",
    "produced_at": "2026-07-24T04:00:00Z"
  },
  "policy_version": "guardian-policy-lab-v1",
  "event_id": "event-control-plane-001",
  "event_type": "request_received",
  "actor_id": "operator-lab-001",
  "worker_id": "arc-worker-001",
  "request_id": "request-control-plane-001",
  "decision_id": null,
  "guardian_decision_id": null,
  "parent_event_id": null,
  "payload_hash": "sha256:2222222222222222222222222222222222222222222222222222222222222222",
  "redacted_summary": "Supervisor accepted a structured Arc status request.",
  "outcome": "received",
  "reason_codes": [],
  "runtime_authority_blocked": true,
  "executable": false,
  "execution_allowed": false,
  "side_effects_allowed": false,
  "created_at": "2026-07-24T04:00:00Z"
}
